CropID,SciName,Info
2000,Spondias cytherea,"BRIEF DESCRIPTION  A medium-sized to tall evergreen or deciduous tree usually reaching 15-25 m in height but sometimes up to 45 m, with a trunk diameter up to 45-90 cm. Leaves with 4-10 pairs of leaflets, and fruit an ellipsoid or globose drupe, 4-10 cm x 3-8 cm and bright-orange. USES  Fruit of the best forms is eaten fresh, but most ripe fruit is stewed or used for jams, jellies or juice. The fruit can be preserved boiled or dried. The green fruit can be used in salads, curries and pickles. Young steamed leaves are used as vegetables. The fruit is fed to pigs and the leaves are eaten by cattle. The fruit, bark and leaves have medicinal properties. GROWING PERIOD  Fast-growing perennial. Bears 4-5 years after planting and yields increase to 8 years. Economical life is 20-25 years. The fruit matures 6-8 months after flowering. COMMON NAMES  Ambarella, Great hog plum, Otaheite apple, Pomme de cythere, Ciruela judia, Jobo de la India, Caja-manga, Tabiriba do Sertao Cajarana, Kedondong, Kedondong manis, Hevi, Gway, Mokak, Jew plum, Vi, Evi, Golden apple, English plum, Pomerac, Mombin jaune, Prune mombin, Mombin de Malabar, Kook hvaan, Makok-farang, Coc. FURTHER INF  Scientific synonyms: S. dulcis, S. mangifera, Condonum malaccense, Poupartia dulcis, Evia dulcis, E. amara var. tuberculosa. Ambarella is native of Polynesia and South and South-East Asia. It is adapted to the hot tropics and frost-free subtropics, it can be grown at elevations between sea level and 700-1000 m. It is however best adapted to the hot, lowland tropics. It prefer over 100 mm rain per month for 6 months and under 60 mm rain per month for the last 6 months."
1997,Spinacia oleracea,"BRIEF DESCRIPTION  The two main types of spinach are smooth-leaved and savory-leaved or winkled. A low, glabrous, herbaceous plant, 20-150 cm tall when flowering, with a long taproot and with spreading or erect dark green rosette leaves. The leaf rosette is about 25-50 cm in diameter and 10-20 cm high. USES  The leaves are high in vitamin and mineral content, they are marketed frozen, canned, or fresh. It is usually consumed after a light cooking. GROWING PERIOD  Annual. Seedligs emerge 6-20 days after sowing, 35-100 days later the leaves are fully grown. Seeds mature about 60-70 days after flowering. COMMON NAMES  Spinach, Epinard, Peleng, Puileng, Horenso, Sosolon a gadong a kamo, Puaileng. FURTHER INF  Spinach is not known in a wild state. Probably it originated in southwestern Asia. It is best grown in soils well supplied with organic matter and in areas with medium to high relative humidity. Asian, short day cultivars require photoperiods of 12-14 hours to flower, while European, longday culktivars need at least 14 hours. Yields vary from 10 t/ha in Asia to 35 t/ha for summer crops in Europe and the United States."
1991,Spathodea campanulata,"DESCRIPTION: It is a deciduous tree reaching 10-35 m in height, with a round, heavy crown of dense, dark foliage. The flowers bloom with great profusion, and the trees can be seen from great distances. USE: The seeds are edible. The hard central portion of the fruit is used to kill animals. The bark has laxative and antiseptic properties, and the seeds, flowers and roots are used as medicine. The bark is chewed and sprayed over swollen cheeks. The bark may also be boiled in water used for bathing newly born babies to heal body rashes. The tree is grown for shade as an ornamental, avenue tree and in coffee plantations. Also planted for revegetation and as a living fence. GROWING PERIOD: Perennial. COMMON NAMES: African tulip tree. FURTHER INF: The species is found throughout tropical Africa and is widely grown as an ornamental. It grows naturally in Africa in secondary forests in the high forest zone and in deciduous, transition, and savannah forests. It colonizes even heavily eroded sites, though form and growth rate suffer considerably on difficult sites. It develops best in fertile, deep, well-drained loams. Soil texture may range from loamy sands to clays, pH is between 4.5-8, and soil drainage may vary from poor to excessive."
10000,Sphenostylis stenocarpa,SOURCES (S. stenocarpa (Hochst. ex A. Rich.)
17012,Sparganium erectum,"DESCRIPTION: It is a herbaceous aquatic plant reaching up to more than 1 meter in height and 0.6 meter in width. The leaves are long, keeled, alternate, stiff and erect or limp and floating, linear and up to 3 cm wide. The stem carries a branched inflorescence of globular heads. USE: The rhizome and stem is edible when cooked. An infusion can be mixed with other plant leaves and used in the treatment of chills. It is grown as an ornamental in garden ponds. GROWING PERIOD: Perennial. COMMON NAMES: Bur-reed, Branched bur-reed, Aufrechter igelkolben. FURTHER INF: It can be found in ungrazed marshes, wet ditches and shallow water of swamps, canals, fens, lake-sides and ponds. It grows best in silty mud and peat in nutrient rich water between 10-20 cm deep. It is easily uprooted and therefore does not grow well by fast-flowing rivers or streams. It can be found in most of central and northern United States and adjacent Canada and in Europe from France through southern Scandinavia and the northern Mediterranean region into northern Russia."
9979,Soymida febrifuga,SOURCES
9984,Spartium junceum,"BRIEF DESCRIPTION  A shrub growing 1-3 m tall. It has large yellow flowers. USES  The fiber obtained from the crop is used for robes, canvas, coarse cloths, mats, pillows, and paper. It does not rot or lose strength in humid weather. Plant stems can be rubberized and used for conveyer belts. The flowers contain an essential oil used in perfumes. The plant can be grown as hedges and low windbreaks. GROWING PERIOD  Perennial, flowers from May to August in the northern hemisphere, and year round in some tropical areas. First harvest are made after 3 years and subsequent harvests can be taken at 18 months interval. COMMON NAMES  Spanish broom, Weaver's broom. FURTHER INF  Scientific synonym: Genista juncea. Spanish broom is native of southwestern Europe and the Mediterranean region."
9970,Sorghum x drummondii,"BRIEF DESCRIPTION  A tall, erect, leafy, medium coarse grass with many stems reaching 1-3 m in height. The root system is fibrous, deep, and very extensive. USES  Used for fodder, hay, and summer pasture. GROWING PERIOD  Fast-growing annual growing in the summer. COMMON NAMES  Sudan grass, Garawi, Pasto Sudan, Batag, Bukakau, Layagah, Ya-sudan. FURTHER INF  Scientific synonyms: Sorghum arundinaceum v. sudanense, S. vulgare v. sudanensis, S. sudanense, S. bicolor ssp. drummondii. Sudan grass originated in southern Egypt and Sudan. It can be found at elevations between sea level and 300 m in Australia. Sudan grass is well adapted to warm conditions with low humidity, but under these conditions it respond well to irrigation. Hay yields in humid areas may be 3.5-16 t/ha while yields in semiarid regions vary between 2-8 t/ha. In the United States the grass can under irrigation yield up to 20-40 t/ha of green fodder. Seed yield is about 0.5 t/ha."
1990,Sorghum X almum,"BRIEF DESCRIPTION  A robust grass reaching up to 4.5 m in height usually with a short rhizomes reaching as deep as 50 cm. USES  It withstands heavy grazing but not heavy trampling. It can be cut for hay. KILLING T  May withstand -15°C. GROWING PERIOD  Short-lived perennial grass growing from spring to autumn, 80-120 days to first harvest. Cutting at 5 cm every six to 12 weeks gives higher yields than cutting at 15 cm. Cutting every three weeks reduce yields. COMMON NAMES  Columbus grass, Pasto colon, Sorgo negro, Batag, Gau, Ya-sokum. FURTHER INF  Columbus grass probably originated in Argentina. The latitudinal range of the grass is 25°N to 30°S. It can be found at elevations between sea level and 700 m. In humid areas it becomes more susceptible to leaf diseases and it can also become a weed. Dry matter yields are usually between 4-12 t/ha, but can reach 19 t/ha."
1983,Sorghum halepense,"BRIEF DESCRIPTION  An erect grass, with culms from 60-290 cm in height. It forms extensive underground root systems. USES  Used for fodder. KILLING T  It is susceptible to frosts but the rhizomes usually survive. GROWING PERIOD  Perennial grass growing from spring to autumn. COMMON NAMES  Johnson grass, Grama China, Maicillo, Sorguillo, Sorgo de Alepo, Aleppo grass, Don Carlos. FURTHER INF  Johnson grass is believed to be of Mediterranean and western Asian origin. It is common in moist areas on river banks, in clay soils and wet sandy soils. Best known as one of the 10 most noxious weeds in the world. It is a serious weed problem in cotton, corn, soybeans, sugarcane, fruit and nut orchards, and vegetables, and mentioned as a problem in 53 countries. In Texas it can yield 17-18 t/ha of hay under irrigation. Rhizomes production may be 10-50 t/ha. Seed yields of 0.3 t/ha are considered good. At day-length of 12 hours is thought to be the optimum for flowering, with above 14 hours of light the grass fail to flower, and above 16 hours all growth processes are inhibited."
1982,Sorghum bicolor var. sweet,"DESCRIPTION: A single-stemmed grass and cereal crop reaching a height of 1-5 m; it is usually taller than grain sorghum. It has a strong root system and a layer of heavy disilicate covers the epidermis of the root. As the root grows to maturity it forms an entire silicon column; which provides it with enough mechanical density during a drought period to prevent the root system from collapsing. It has fibrous, spreading roots and consists of a primary, secondary and supporting roots. The primary root is developed from the seed embryo. It is the only embryo root produced by the seed during germination. Before the production of secondary roots, the primary root is the main organ by which the plant absorbs nutrients and moisture from the soil. Prop roots may grow from culm nodes. There is a bud at each node from which a tiller may grow. The only temporary root in sorghum is the single radicle of the germinating seedling. Mature roots of sorghum are all adventitious. Those permanent roots have numerous branched lateral roots interlacing the soil in all directions. The system may extend to at least 1.5 m away from the plant, and is most abundant in the top 90 cm, although it may extend to twice that depth. One of the important factors affecting water use and drought endurance must be the effectiveness of the root system. While the primary roots of maize and sorghum are equally extensive, sorghum possesses twice as many secondary roots as maize at any one stage of growth. After the plant produces 3-4 leaves, secondary roots grow out from the base of the stalk node near the soil surface. The stalk has about 10-20 clearly protruding nodes and a leaf is produced from every node. Leaves (30-135 cm long and 6-13 cm wide) are opposite-decussate and consist of the sheath, blade and tongue or ligule. The sheath is very long and adheres closely to a major part of the internode. The blade is broad, strap-like, dentate and the surface is smooth and covered with a waxy powder which plays a role in reducing evaporation. In dry conditions, the leaf blade will roll up into a tube, reducing the exposed area and thus cutting down the loss of moisture. Flowers are grouped in an apical panicle formed by several reddish spikelets. The grain is an oblong caryopsis; which consists of the seed coat, testa, endosperm and embryo. The shapes and colours of seeds are very varied and are covered by glumes and there are round, flat-round, oval, ellipse shapes etc. The colours include white, light yellow, pink, brown, red-brown, dark brown etc. In general, the seed of sweet sorghum is smaller than that of grain sorghum; the thousand-seed weight is about 21g varying between 16-28g. (25,000 to 61,740/kg for sweet and grain sorghum; 120,000 to 159,000/kg for grass sorghum). USES: The versatility of sweet sorghum resulted in Prof. Li Dajue (of the Chinese Academy of Sciences) and Peter Griffee (FAO) coining the name the ""Four F's Crop"" for sweet sorghum in 1997 at the first International Sweet Sorghum Conference. The ""Four Fs"" represent the four potential outputs from sweet sorghum, namely: Food, Fuel, Fodder, & Fibre. In Asia, R&D has concentrated on maximizing all four outputs to produce the 'multi-purpose' varieties, whilst in Europe, the potential use of sweet sorghum as a sugar producer for fuel ethanol production has driven the current direction of R&D towards liquid bio-fuel production. In southern Africa, the potential for using sweet sorghum for energy and crystalline sugar production is being explored. A disadvantage is that the stems have to be processed within a matter of hours after harvest. However, new technology is emerging for in-field juice extraction and storage to extend the factory processing period. The grain can be ground into flour, some cultivars can be used as popcorn and the grain can be manufactured into beer. Stems are used for thatching, fencing, brushes, and basketry. A dye can be extracted. Grain and straw can be fed to livestock and embryos yield an oil used in cooking and salad oils. The inflorescence has astringent, haemostatic and antidiarrhoeic properties and administration is as infusion, tincture and medicinal wine. GROWING PERIOD: Annual or short-term perennial grass. Most sorghum plants take 90-120 days to mature, the boot stage is reached in 50-60 days, flowering in 60-70 days and full grain maturity in 90-120 days. COMMON NAMES: Sorghum, Sorgho, Sorgo, Great millet, Milo, Jowar, Cholam, Guinea corn, Durra, Mtama, Jowal, Jolar, Cholam, Koaliang. FURTHER INF.: Lowland tropical sorghums are adapted to warm days and night temperatures above 22°C throughout the growing season. The poisonous glucocide 'dhurrin' in sorghum is present from germination, increasing to a maximum and then disappearing as the grain develops, so that in the later stages the plants is safe as fodder. New long day varieties exist. The photosynthesis pathway C4III. The species is probably indigenous to North-East Africa, north of latitude 10°N and east of longitude 25°E. Sorghum is grown between 40°N and S. Sweet sorghum can be found at elevations between sea level and 1500 m, most East African sorghum is grown between the altitudes of 900-1500 m, and cool-tolerant varieties are grown between 1600 and 2500 m. The nutrient removal for 1 ton of grain is about 50 kg N, 9 kg P, and 45 kg K, calculated from the above-ground plant mass. Grain yields of up to 4 t/ha can be obtained, but in the driest areas, the yield usually varies between 0.3-1.2 t/ha, and the global average is about 1.3 t/ha. Like the common grain sorghum, sweet sorghum can produce grain yields of 1500-7500 kg/ha. But the essence of sweet sorghum is not from its seed, but from its stalk; which contains sugar. In general, the stalk yield is 45000-75000 kg/ha. The sugar content in the juice of sweet sorghum varies in different varieties. It's Brix ranges generally from between 15-23%."
48747,Sorghum bicolor,"DESCRIPTION: Summer annual, coarse, erect with much variability in growth characteristics; culms solid or sometimes with spaces in pith, 0.6ˆ5 m tall, depending on variety and growing conditions, 5 to over 30 mm in diameter, either dry at maturity or with sweet insipid juice; leaves broad and coarse, similar in shape to those of corn but shorter and wider; blades glabrous and waxy; sheaths encircle culm and have overlapping margins; panicle erect, sometimes recurved, usually compact in most grain sorghums and more open in forage types; seed covered by glumes that may or may not be removed by threshing; prop roots may grow from culm nodes; bud at each node from which a tiller may grow; seeds white, yellow, red, or brown; panicle with up to 6,000 spikelets. Seeds 25,000 to 61,740/kg. USES: Grown for grain, forage, syrup and sugar, and industrial uses of stems and fibers. Grain sorghum is a staple cereal in hot dry tropics, the threshed grain ground into a wholesome flour. Stalks used as animal feed. Important summer fodder where temperatures are high and rainfall insufficient for corn. Most important for silage or green soiling, or for hay when grown irrigated in very dry areas. FURTHER INF.: Ranging from Cool Temperate Steppe to Wet through Tropical Thorn to Wet Forest Life Zones, sorghum is reported to tolerate annual precipitation of 2.0 to 41.0 (mean of 86 cases = 10.9), annual temperature of 7.8 to 27.8°C (mean of 86 cases = 20.1), and pH of 4.3 to 8.7 (mean of 69 cases = 6.7). Adapted to tropical and subtropical summer rainfall climate with rainfall from 25ˆ125 cm annually; of little importance in more humid areas with higher rainfall. Some cvs are short-day plants. Adapted to wide range of soils varying from light loams to heavy clays; thrives best on light, easily worked soils of high fertility, with moderate to high available water, with erosion not a problem. Moderately well-drained soils are suitable for sorghums. Small amounts of alkali in sand reduces performance considerably. Tolerance to salinity is moderate. Prefers moderately acid soil; pH down to 5.7 does not drastically affect production."
9942,Sorbus domestica,"DESCRIPTION: A deciduous or evergreen tree up to 15 m in height, with panicles of white flowers up to 10 cm long in late spring, followed by an abundance of pear or apple-shaped fruits on mature trees. Unusual orange-brown scaly bark. USE: The fruit needs to be stored until soft before use. GROWING PERIOD: Perennial. COMMON NAMES: Servant tree. FURTHER INF: It originates from Southern Europe, western Asia and northern Africa."
1978,Sonneratia caseolaris,"BRIEF DESCRIPTION  A shrub or a small to medium-sized evergreen tree reaching 5-15 m, rarely up to 20 m in height. The trunk without buttresses or stilt roots and the crown rather open and spreading. USES  Wood used for construction, poles, posts, boatbuilding, and firewood. ""Breathingroots"" can serve as cork. Young berries are edible and used as a fruit vegetable, pectin can be extracted from the fruits. Young fruits are sour tasting and used as a flavouring. Mature fruits have a cheese-like taste and are eaten raw or cooked. They also have medicinal properties. Leaves can be eaten raw. The bark can be extracted for tannin. GROWING PERIOD  Perennial. COMMON NAMES  Crabapple mangrove, Mangrove, Orcha, Kirilla, Kinnai, Berembang, Padada, Pagatpat, Pedada, Pidada, Perepat, Bedada, Bidada, Bogem, Pagapate, Hikaw-hikawan, Bunayon, Tapoo, Tamoo, 'am'-pie, Lamphu. FURTHER INF  Scientific synonym: S. acida, S. obovata, Rhizophora caseoralis. Crabapple mangrove is native of South and South-East Asia, where it is common in mangrove forests of shilty tropical shores, generally in the less salty inner parts. Its characteristic habitat consists of river banks and tidal areas with mud banks, often in upstream estuarine positions of rivers subjected to large volumes of freshwater run-off or with slow-moving brackish or fresh water and as far inland as the salt water floods."
9938,Sonneratia apetala,BRIEF DESCRIPTION
9922,Solenostemon rotundifolius,BRIEF DESCRIPTION  A herb with prostrate or ascending habit 
1970,Solanum torvum,"BRIEF DESCRIPTION  A spreading or scrambling slender shrub, up to 3 m tall, pubescent with stellate hairs. Leaves ovate, 7-20 x 4-18 cm, fruits. USES  The unripe fruit are eaten raw or cooked as vegetables and in curries. The roots have medicinal properties. It is sometimes used as rootstock for tomato to resist bacterial wilt, and for eggplant. GROWING PERIOD  Perennial. Plants are said to have an economic lifetime of 3-4 years. COMMON NAMES  Plate bush, Devil's fig, Terongan, Turkeyberry, Takokak, Pokak, Terong pipit, Terong rembang, Podopodo kai ra ta ba rau, Takapasin, Taogotan, Balbalusa, Kh'eengz faaz, Kh'eengz saph'au. FURTHER INF  Scientific synonym: S. ferrugineum, S. largiflotum. Plate bush originates from the Antilles, but is now a pantropical weed, occasionally cultivated. It occurs at elevations up to 1600 m. Heavy rainfall discourages fruit set."
1971,Solanum tuberosum,"DESCRIPTION: Erect or clambering succulent herbaceous branched tuber crop up to more than 1 m tall, the stems sometimes quadrangular or even winged. Leaves alternate, imparipinnate, short-stalked, 10-30 cm long, 5-15 cm wide, the leaflets opposite or alternate, very unequal in size and shape, the larger often petiolulate, ovate to ovate-oblong, enequilateral, apically acuminate to acute, basally subcordate, 2-10 cm long, 1-6 cm wide, the smaller more blunt apically, more cordate basally, broadly ovate to orbicular, 2ˆ15 mm in diameter, thinly to densely pubescent. Flowers white or blue, pedunculate in lateral, many flowered cymes, the hairy peduncle 5-15 cm long, the jointed hairy pedicels 3-35 mm long. Calyx campanulate, 5-lobate, 1.5-2 cm in diameter, the lobes acute or acuminate. Corolla twice as long as calyx, 3.5-4 cm in diameter. Anthers free, erect, poricidal, yellow. Fruit a globose 2-celled berry, many-seeded, yellowish green. The tubers are mostly located within the top 25 cm of the soil. USES: It is cultivated for its edible tubers. Tubers are one of the temperate staples, eaten boiled, baked, fried, stewed, candied with syrup, or pureed and they are processed into fried chips, starch, flour, glucose, and alcohol and they can be canned or dehydrated etc. Surplus potatoes are used for fodder and alcohol, and chemurgic applications. The flour can be used for baking. Potato starch is used to determine the diastatic value of starch. Boiled with weak sulphuric acid, potato starch is changed into glucose and fermented into alcohol. It is estimated that potatoes would give 104 liters ethanol per ton of production. Rotten potatoes and the waste in the potato chip industry can be converted to butanol with a greater energy content than ethanol. Twenty percent butanol can be added to regular gas and up to 40% to diesel as extenders without engine modification. Ripe potato juice is excellent for cleaning cottons, silks, and woolens. Root and leaf diffusates of growing potato plants possess cardiotonic activity. Dried ethanol extracts of above-ground parts show marked hypotensive and myotropic action and a spasmolytic and soothing effect on intestinal musculature. Ethanol extracts of leaves have antifungal properties, active against Phytophthora infestans. Leaves, seeds, and tuber extracts show antimicrobial activity against Gram-positive and Gram-negative bacteria. The tubers contain 8-28% starch and 1-4% protein. KILLING T.: -1"
1968,Solanum quitoense,"BRIEF DESCRIPTION  A slightly woody herb or semi-shrub reaching a height of 1-3 m, with large velvety purple tinged leaves, fruits larger than an egg, in clusters, covered with a wiry pubescence that rubs off, orange exterior but green flesh, and highly aromatic. USES  The fruit is made into preserves, pies, and the juice is mixed with water or milk to make a drink rich in proteins and mineral salts. GROWING PERIOD  Short-lived perennial. Bear after 180-365 days, fruits are harvested by hand when mature. Economical life often only 2-4 years, due to root-knot nematodes. COMMON NAMES  Naranjilla, Naranrilla, Lulu, Lulo, Morelle de Quito, Orange de Quito, Ecuador's naranjilla, Quito orange, Cocona, Lullo, Lullo de Castilla, Naranjilla de Quito, Tomate chilena, Torinja, Puscolulu, Naranjita, Toronja, Lulo-frucht, Terong kuning. FURTHER INF  Scientific synonyms: S. hirsutissimum, S. angulatum. Naranjilla is native of midelelevations in the Andes of Colombia and Ecuador. It is widely cultivated in humid upland areas of Ecuador, Colombia and Peru at elevations between 1000-2500 m. In New Zealand and California it is grown at sea level. It is very sensitive to nematodes. Yields of fruit are about 1-3 t/ha with fruits averaging 40-70 g each."
9868,Solanum oleraceum,SOURCES
1966,Solanum nigrum,BRIEF DESCRIPTION  A herbaceous plant reaching a height of 
9916,Solanum x juzepczukii,"BRIEF DESCRIPTION  A herbaceous plant reaching 30-50 cm in height with a semi-rosette growth habit, long leaves. S. x juzepczukii has a small, blu corolla and a shallow root system, while S. x curtilobum has a larger, purple corolla and a deeper roots. USES  The tubers have to be frosen and dried, in order to remove the glycoalkaloids, before it can be eaten. GROWING PERIOD  Annual, maturing after 150-195 days. COMMON NAMES  Bitter potato, Luki, Ruku, Rucki, Choquepito, Ococuri. FURTHER INF  Bitter potato is cultivated in central and southern Peru and northern Bolivia at altitudes between 3000-4300 m. (pH estimated by the compiler)."
2528,Solanum muricatum,BRIEF DESCRIPTION  A herbaceous plant 50-100 cm in height 
9878,Solanum macrocarpon,"BRIEF DESCRIPTION  A glabrous, erect or climbing, unarmed, herbaceous plant reaching up to 1.5 m tall with blackish violet stem, woody at the base. Leaves oblong-lanceolate, 10-30 x 4-15 cm and fruits depressed globose, 5-6 cm x 7-8 cm, orange-yellow. USES  Used as a fruit and leaf vegetable. The young mature fruits are usually cooked and used in curry and soup. The leaves can be eaten raw, cooked or steamed. GROWING PERIOD  Perennial, first selectively harvest of leaves may be taken after 40-50 days and ripe fruit may be harvested after 80-100 days. COMMON NAMES  African eggplant, Native eggplant, Local garden egg, Gboma eggplant, Aubergine gboma, Terong engkol, Terong kelapa, Trong gayung, Terong santan, Terong rapoh, Osun. FURTHER INF  Scientific synonym: S. dasyphyllum. African eggplant originates from the wetter parts of tropical and subtropical Africa where wild and cultivated forms occur. In Indonesia and Malaysia it is cultivated at elevations between sea level and 600 m."
