CropID,SciName,Info
289,Abelmoschus esculentus,"BRIEF DESCRIPTION  A herbaceous, upright, often much branched, slightly woody plant, up to 2-4 m in height, with spiny pubescence, large yellow flowers, and fruits which at maturity dry to a longitudinally dehiscent capsule, 25 cm long or more. USES  The young immature fruits are eaten fresh, cooked or fried as vegetables and the can be frozen, canned or dried. Fruits have medicinal properties. Ripe seeds contain 20% edible oil and they can be used as a substitute for coffee. In India, mucilage from the roots and stems has industrial value for clarifying sugarcane juice in gur manufacture. Dried okra powder is used in salad dressings, ice creams, cheese spreads, and confectionery. The stems provide a fiber of inferior quality. GROWING PERIOD  Annual. May require 50-90 days to first harvest and the harvest period may continue up to 180 days. COMMON NAMES  Okra, Ochro, Lady's Finger, Gumbo, Gombo, Cantarela, Quingombo, Rosenapfel, Bindi, Bhindee, Bhindi, Mesta, Vendakai, Kachang bendi, Kachang lender, Sayur bendi, Kachieb, Grajee-ap morn, You-padi, Ch'aan K'e, Tsau Kw'ai, Ila, Ilasha, Ilashodo, Quimbambo, Kopi arab, Khua ngwang, Krachiap mon, Dau bap. FURTHER INF  Scientific synonym: Hibiscus esculentus. Okra originated in South-East Asia. Most varieties grow well in the lowland humid tropics up to elevations of 1000 m. Adapted to moderate to high humidity. Okra is a short-day plant, but it has a wide geographic distribution, up to latitudes 35-40°S and N. Yields of green pods are often low, about 2-4 t/ha owing to extreme growing conditiuons, but  up to 10-40 t/ha may be produced."
2582,Acacia ataxacantha,"DESCRIPTION: A scrambling shrub or climber with long slender branches, yellow-brown bark, with light brown slash. Flowers 4-8 cm long, dense, subsessile in axillary white spikes. USE: Palatable but lightly browsed. Much used for making impenetrable live fences. Long, straight shoots used as walking sticks, bows, poles. Bark used for ropes. Ethno-medicine against syphilis, boils, helminthiasis and wound treatment, headache, toothache, respiratory diseases. GROWING PERIOD: Perennial. COMMON NAMES: Flamethorn, Vlamdoring. FURTHER INF: Occasionally forming dense thickets at the Sahelian-Sudanian ecozones border, particularly in post-clearing successions, often associated with Combretum micranthum. Often located on termitaria, and particularly on shallow hardpans. Common along water courses with a favourable water supply. Found on shallow iron or lateritic hardpans, with a silty to loamy surface layer."
2589,Acacia brassii,"BRIEF DESCRIPTION  A shrub or small tree usually 4-10 m in height. USES  The wood can be used as fuel and the tree can provide shelter. GROWING PERIOD  Fast-growing perennial. COMMON NAMES  Acacia brassii. FURTHER INF  Acacia brassii occurs in northeastern Queensland, Australia at latitudes between 11-15°S and elevations from sea level to 200 m. It can be found on flat to gently undulating country and on stream banks."
2586,Acacia bidwillii,"BRIEF DESCRIPTION  A small tree reaching a height of 6-12 m, with a fairly straight trunk up to 1/2 to 3/4 of the tree height and a moderately open crown. USES  It has limited value as dry season fodder. The wood can be used as fuel, posts, and poles. The tree can provide shade and shelter. GROWING PERIOD  Fast-growing perennial. COMMON NAMES  Corkwood wattle, Yadthor, Waneu. FURTHER INF  Corkwood wattle ocuurs in northern and eastern Australia at latitudes between 16-26°S and elevations from sea level to 350 m. It is mainly found on undulating country with some areas of gentle hills. The tree is fire-resistant. It has become a weed in some pastural areas of Queensland. (pH estimated by the compiler)."
11711,Acacia brevispica,"DESCRIPTION: A shrub 2 to 5 m high with long, thin, rambling branches covered with small scattered thorns. The leaves are fairly large and the white flowers are in globose heads. The pods are thin, flat and broad. USE: Goats browse on this bush to a considerable extent, eating the leaves, flowers and young pods. It is seldom eaten by cattle because of its thorny branches. The leaves and young pods have a protein content of 17 to 19 percent. GROWING PERIOD: Perennial. COMMON NAMES: FURTHER INF: It is widespread in woodland savannas of Africa, being found in the Sudan, Ethiopia, Somalia, Kenya, Zaire, Angola, Natal and Cape Province. In Kenya, it occurs at 1600 to 2000 m in elevation, where it often forms dense thickets on well-drained slopes in deep and fertile red soil. It is one of the species within the Acacia genus that is non-nodulating."
295,Acacia auriculiformis,"BRIEF DESCRIPTION  A low to medium-sized fast growing deciduous or evergreen tree. The tree can reach a height of 8-30 m and a trunk diameter of up to 60 cm. It has bright yellow flowers. USES  The wood can be used for firewood, charcoal, and high quality sulphate and neutral sulphite semichemical pulp. Tanning and dye can be extracted from the bark. The tree can provide shelter in beach a sea-front plantings, it can be used for revegetation of mining spoil heaps and wastelands, to stabilise steep eroded land, for shade and as an ornamental. It is mentioned as a possible agroforestry species. GROWING PERIOD  Perennial. Tolerate a dry season of 120-240 days. Can be grown with a rotation of 10-12 years. COMMON NAMES  Tan wattle, Northern black wattle, Earpod wattle, Darwin black wattle, Akashmoni, Australia babul, Kasia, Papua wattle, Japanese acacia, Auri, Kasia. FURTHER INF  Scientific synonyms: A. moniliformis, A. auriculaeformis. Tan wattle is indigenous to northeastern Australia, New Guinea, and the Kei Islands of Indonesia. It can be found naturally occuring within the latitudinal range 7-20°S, at altitudes between sea level and 600 m. It occurs naturally in coastal lowlands, in closed forests along streams, in low open forests and savannas, adjacent to mangroves, or behind beaches. It can grow on step slopes. Optimum annual wood production is 10-20 m3/ha. The tree fixes nitrogen and regenerates rapidly. Branches break easily in storm winds and the tree is not very fire resistant. In Florida the tree has become a weed."
2588,Acacia brachystachya,"BRIEF DESCRIPTION  A shrub or small tree reaching a height of 3-7 m. Usually branching from the base, with a spreading rounded crown of upright branches. USES  The wood can be used as fuel and for small ornamental objects. The leaves can provide low quality fodder. The seeds are edible. GROWING PERIOD  Perennial. COMMON NAMES  Umbrella mulga, Turpentine mulga, Narrowleaf mulga. FURTHER INF  Umbrella mulga is withspread in the arid interior Australia at latitudes between 21-34°S and at elevations up to 600 m. The tree is drought hardy, it fixes nitrogen and is mentioned as a possible agroforestry species."
2583,Acacia aulacocarpa,"DESCRIPTION: There are two varieties: var. fruticosa is a bushy shrub up to 2-3 m tall, while var. aulacocarpa often is a small to medium sized tree reaching 5-35 m in height, depending on the site. Under favourable conditions the trunk is straight and may reach 100 cm in diameter. USES: The wood is a good fuel when dry and it can be used as light structural and flooring timber, for boatbuilding, furniture and cabinet work, joinery and turnery. The tree can be utilized for light shade an as an ornamental. GROWING PERIOD  Fast-growing perennial. COMMON NAMES: Brown salwood, Bush ironbark wattle, Papua New Guinea brown wattle, Hicory wattle, Black wattle. FURTHER INF.: In Australia, the latitudinal range of brown salwood is 6-31°S and it occur at elevations between sea level and 1000 m. The tree can grow on a wide range of topography and although it is often found on flats and gently undulating terrain it may occur on steep rocky slopes."
2581,Acacia argyrodendron,"BRIEF DESCRIPTION  A tree normally reaching a height of 12-15 m but can reach up to 20 m and have a well shaped, straight trunk. USES  Can be used as cattle and sheep fodder. The wood can be utilized as firewood, charcoal, posts, poles, and rail material. The tree can be used for shelter erosion control, and menity plantings. GROWING PERIOD  Perennial. Withstanding a dry period of 4-6 months. COMMON NAMES  Black gidyea, Blackwood. FURTHER INF  Black gidyea occurs in northeastern Australia at latitudes between 20-24°S and at elevations from 150-350 m. It is mainly found on gently undulating country and plains."
2579,Acacia aneura,"BRIEF DESCRIPTION  Varies from a shrub 2-5 m tall, with markedly ascending branches in dry areas, to a small tree up to 9-15 m, with a well-defined main stem but less oblique branches in areas of higher rainfall. USES  Can be utilized as fodder, and for erosion control, shelter or as an ornamentel. The wood can be used as fuel and fence posts. The seeds are edible. GROWING PERIOD  Perennial. COMMON NAMES  Mulga. FURTHER INF  Mulga has a very wide distribution in central, eastern and western Australia. In Australia, the latitudinal range of Mulga is 18-34°S and it occurs at elevations between sea level and 1000 m. Mulga usually grows on flood and erosional plains, in broad vally heads and sand dunes. It is nitrogen fixing."
126290,Acacia angustissima,"DESCRIPTION: A thornless shrub or small tree, 2ˆ7 m high with a single short trunk. Leaves bipinnate, predominantly asymmetric with a displaced mid-vein, 10ˆ25 cm long, with 10ˆ20 pairs of pinnae. Inflorescences ellipsoidal with whitish heads 1ˆ1.5 cm in diameter, turning pinkish to dull orange when dry. Pods very thin-walled, papery, oblong , 3ˆ6 cm long and 6ˆ9 mm wide, with straight or sinuate margins, initially green, turning coffee-brown when ripe. USE: As a dry season forage and green manure. GROWING PERIOD: Perennial. COMMON NAMES: Chisos prairie acacia, Shreve's prairie acacia. FURTHER INF: Grows naturally on free-draining acid soils. Adapted to a wide range of soils including vertisols of slightly alkaline pH. In the native range, annual rainfall varies from 800ˆ3000 mm. Withstands moderate periods of drought , retaining its leaf through the 8-month dry season in eastern Indonesia. It grows naturally from near sea level to 2800 m in environments where mean temperatures range from 25ˆ30°C. Shows better growth potential at the higher elevations and moderate temperatures. It tolerates cold climates once established (occasional temperatures below freezing). May have moderate shade tolerance being native to oak/pine forests."
2575,Acacia ammobia,"BRIEF DESCRIPTION  A small tree with one or several stems reaching a height of 3-6 m. USES  The wood can be used as posts, poles, rail material, and fuelwood or charcoal. The tree can be used for soil stabilisation, low open shelter and windbreak, and ornamental planting. GROWING PERIOD  Perennial. COMMON NAMES  Acacia ammobia. FURTHER INF  Acacia ammobia has a limited natural distribution in central Australia between latitudes 23-26°S at elevations between 450-600 m. It occur on sand dunes and in sandy areas with scattered sandstone or less commonly on stony ridges and hills. It is killed by fire but will normally regenerate from seeds in the ground."
1887,Saccharum spontaneum,"BRIEF DESCRIPTION  A grass, free-tillering, often with aggressive rhizomes, reaching a height of up to 8 m, but normally it is 2-3.5 m. Culms slender, hard, pithy, often hollow, with little juice, and leaves 100-200 cm long. USES  It provides sugar, though the sucrose content is low and the fibre content high. Has been used in the breeding of S. officinarum, as it provides vigour, hardiness and resistance to many major diseases. GROWING PERIOD  Perennial, growing 10-24 months, but most sugar cane is grown for 14-18 months for the plant crop and 12 months for the ratoon crop. COMMON NAMES  Wild cane, Pip-pit, Glagah, Tatebu, Talahib, Tigbau, Sidda, 'am'peu prei, Ph'ong, Lau, Phong, Lao, Co'lach. FURTHER INF  Wild cane occurs in a wide region ranging from Africa and Afganistan to Japan and the South Pacific within the latitudinal range 40° to the equator. It can be found from sea level to 1700 m in elevation. It natural habitats includes swamps, saline swamps, deserts, jungles, sandy river flats, and the low slopes of the Himalayas."
2576,Acacia ampliceps,"BRIEF DESCRIPTION  A shrub or small tree reaching a height of 2-8 m. USES  The wood can be used for posts, poles, and fuel. The tree are browsed by cattle, and it can be used for dune rehabilitation on rocky coastal sites an reclamation of salt-effected sites and as a low windbreak. GROWING PERIOD  Fast-growing perennial. It withstands dry periods of 5-9 months. COMMON NAMES  Salt wattle, Jila jila bush, Nyarlka. FURTHER INF  Salt wattle occur in northwestern Australia at latitudes between 14-26°S and elevations from sea level to 400 m. It can be found on plains, sand dunes, along drainage lines or on low-lying or hilly country where it often occur in topographical situations where it recieves additional water. It is tolerant of alkaline, highly saline and waterlogged conditions."
2578,Acacia ancistrocarpa,"BRIEF DESCRIPTION  A multi-stemmed shrub reaching a height of 2-4 m and sometimes up to 8 m. USES  Can be used for firewood, erosion control, and low shelter. GROWING PERIOD  Perennial withstanding a dry season of 7-9 months. COMMON NAMES  Fritzroy wattle, Pindan wattle. FURTHER INF  Fritzroy wattle is common dry sandy and stony soils in northern central and northwestern Australia. It occur within the lattudinal range 16-25°S at elevations between sea level and 500 m. It can be found on a range of topographical situations including coastal plains, ironstone ridges, stony hills, watercourses and alluvial drainage lines. It is nitrogen fixing."
2580,Acacia anticeps,BRIEF DESCRIPTION
11018,Zoysia matrella,GROWING PERIOD: Perennial grass.
11015,Zostera marina,SOURCES
18480,Zornia latifolia,"DESCRIPTION: It is a prostrate, much branched, herbaceous legume, with a tap-root and stems between 20-50 cm long. Leaves bifoliolate, leaflets 1-4 cm long. The inflorescence is a terminal peduncled spike with 1-35 yellow flowers. Pods 2-3 mm long and wide. USE: Used as wild pasture.GROWING PERIOD: Perennial. COMMON NAMES: Tencilla. FURTHER INF: It is native of Central and Northern South America north of latitude 35°S and usually found in open fields and grassy areas. Grows well in areas with 1000-2000 mm rainfall/year; drought resistant, survives dry season of 4-6 months. Well adapted to the free-draining, acid and low-fertility, Al-toxic oxisols of the South American savannas. Little or no shade tolerance. DM yields of 2.4-2.8 t/ha in 12 weeks have been recorded. 0.6-4.9 t/ha when grown in association with Brachiaria decumbens and/or Andropogon gayanus."
11001,Ziziphus mucronata,"DESCRIPTION: It is usually a deciduous shrub or medium-sized tree up to 9 m tall with a trunk that is frequently crooked; branches spreading, often drooping, branching well above ground or near the base. Leaves ovate to broadly ovate, 2.5-8 x 1.9-8 cm, shiny, densely hairy to quite smooth. Fruit a round, reddish-brown, glossy drupe. Trees with 2 types of fruit, the small type 7-10 mm in diameter and the large type 15-25 mm in diameter, all often remaining on the tree after the leaves have fallen. USE: The fruit is eaten fresh or dried, in meal or porridge. The young leaves can be cooked and eaten as spinach. Seeds are roasted, crushed and used as a coffee substitute. Both leaves and fruits are browsed and used as fodder. The flowers are a source of honey. The wood is hard and makes good firewood and charcoal. The bark contains 12-15% tannin. Roots are used as a remedy for pain and to treat snakebite. Boils and other skin infections are treated with leaf paste, and this, together with an infusion of the roots, is a treatment for tubercular gland swellings, measles, dysentery, lumbago and chest complaints. The bark is used as an emetic; bark decoction is used for rheumatism and stomach troubles, bark infusion is used to treat coughs, and bark is used in a steam bath to purify the complexion. It is planted as a living fence. GROWING PERIOD: Perennial. COMMON NAMES: Cape thorn. FURTHER INF: It grows in areas dominated by thorny vegetation in both temperate and tropical climates. Also found in open scrubland, woodland, forest margins and riverine vegetation. It is a very hardy species, most common in dry areas; it is resistant to both frost and drought. Tolerant to shallow soils, seasonal waterlogging, salt spray and soil salinity. Regarded as an indicator of underground water."
17633,Ziziphus mauritiana,"BRIEF DESCRIPTION: A spiny deciduous or almost evergreen shrub or small tree reaching a height of 3-15 m, with a trunk diameter up to 40 cm or more. It has a spreading crown, drooping branches and reddish fruits. USES: It is mainly cultivated for its edible fruits. The fruit can be eaten fresh, dried like dates, or pickled. It can be made into flour meal, butter, cheeselike paste, and alcoholic as well as non-alcoholic beverage. The wood is use for constuction of rural houses, posts, tool handles, farm implements, saddletrees, sandals, turnery, and firewood and charcoal. The tree is planted as living fence, it is browsed by livestock and is mentioned as a possible agroforestry species. Bark contain tannin. Bark and leaves have medicinal properties. Leaves are fed to tasar silkworms and the tree  hosts lac insects for shellac production. GROWING PERIOD: Perennial. Begins to bear after 6-8 years and increase yields to 15-20 years of age. COMMON NAMES:   Indian jujube, Indian plum, Indian cherry, Chinese date, Chinese jujube, Dattero cinese, Datte chinoise, Azufaifa, Giuggiolo, Unabi, Jujube, Jujubier, Beri, Inu-natsume, Ber tree, Ber, De ber. FURTHER INF: Scientific synonyms: Z. mauratianus, Z. jujuba. Rhamnus jujuba. Indian jujube is indigenous to South Asia. It is normally found at elevations from sea level to 600 m, but can be found up to 1800 m. The tree is salt sensitive, but shoots of the plant can be grafted on the roots of Z. nummularia to allow fruit production on saline land. It is drought hardy and does not tolerate high air humidity.  Fruit yields may range from 80-130 kg/tree per year."
372331,Zornia glabra,"DESCRIPTION: Erect, herbaceous legume up to 60 cm tall. Leaves bifoliolate, lower leaflet to 40 mm long, 8 mm broad, the upper leaflet narrower. Flower standard yellow to 13 mm long. USE: Not currently used commercially, but may have application in pastures and is being tested for value in intercropping systems. GROWING PERIOD: Perennial. COMMON NAMES: FURTHER INF: It is native of French Guiana, Guyana, Suriname and Brazil. It is mostly found in areas with annual rainfall of more than 1500 mm and with average annual temperatures ranging from about 23ˆ27ºC. Occurs on ultisols in its native environment, and has proven adapted to ultisols and oxisols in the wet tropics elsewhere. These soils have pH as low as 4, and are of low fertility. It has little or no shade tolerance. Poor tolerance to trampling damage and short defoliation. Recovers fire from soil seed bank and below-ground crown. Moderate yields under savannah conditions in tropical America."
243766,Ziziphus abyssinica,"DESCRIPTION: It is a semi-evergreen spiny shrub, scrambler or small tree up to 12 m tall. It has a spreading, drooping branches forming a heavy, rounded and untidy crown. Leaves ovate to broadly ovate, up to 8 x 4.7 cm. Fruit almost spherical, 2-3 cm in diameter, shiny red or reddish-brown when mature and smooth. USE: The sweet fruits are edible, and the leaves may be cooked as a vegetable and also used as fodder. The flowers are a source of honey. Wood is used as firewood and charcoal, it is also used for furniture, interior work and carving. The bark yields a cinnamon-coloured dye. Ash from the burnt leaves is mixed with salt and applied on the throat to relieve tonsillitis. A fomentation of steaming hot leaves soaked in boiling water are used as on the chest to treat pneumonia. The spiny branches make this plant useful as a protective live fence. GROWING PERIOD: Perennial. COMMON NAMES: Jujube. FURTHER INF: It is found growing in arid or dry tropical and subtropical regions, with severe heat and slight frost. It occurs at medium to low altitudes, in open woodland, open grassland and along riverbanks; it reaches its southernmost limit along the southern escarpment of the Zambezi Valley. The tree grows throughout Zambia except for 5 districts in the northwest corner and is widespread outside Zambia from Senegal and Ethiopia south to Angola and Mozambique. It is locally frequent in the chipya, Kalahari and munga woodlands and in munga scrub and occurs occasionally in other woodland types and on termite mounds. It grows throughout East Africa; in Uganda, it occurs in dry savannah in eastern and northern regions."
10994,Zizania latifolia,"DESCRIPTION: It is a annual or perennial, aquatic plant reaching up to 1.2-2.4 m in height. USE: It is often cultivated as a food plant in Asia, it has edible rhizomes, young shoots, seed and stem bases. The swollen stem bases, infected with a smut fungus, are eaten as a raw or cooked vegetable by the Chinese and is very popular. The leaves can be woven into mats. The shoots, roots and the seed are diuretic and febrifuge. The leaves are tonic. GROWING PERIOD: Annual or perennial depending on growing conditions. COMMON NAMES: Water bamboo, Manchurian wild rice. FURTHER INF: It requires hot summers with temperatures between 20-30°C if it is to do well. At 20°C, the plant grows poorly and the harvested stems are not tender. It withstands winter temperatures in England and in Beijing. A marsh or water plant requiring poorly drained soil, shallow stagnant or better slowly flowing water. It is easily grown in most soils but thrives in slightly acidic, clay or clay-loam soil high in organic matter."
2177,Zingiber officinale,"BRIEF DESCRIPTION  A slender, erect herbaceous plant, 30-100 cm high, with a robust branched rhizome borne horizontally near the soil surface, bearing leafy shoots close together. The fleshy sympodial rhizome is hard, thich and usually pale yellow within. USES  The underground stem is used as a spice for culinary purposes and for ginger beer, ginger ale and ginger wine. An essential oil is used in flavoring essences and perfumery. It also has medicinal properties. Mentioned as a useful agroforestry species. GROWING PERIOD  Perennial, usually grown as an annual. In India, the crop is usually planted in May, and in Queensland in September. The plant can be harvested after 270-365 days, when the stalks begin to wither. COMMON NAMES  Ginger, Gingembre, Jingibre, Ingwer, Zingibel, Zinjibil, Zanzai, Then-schibel, Gingebela, Zenjibil, Dendabil, Kundi, Zanjabeel, Sankanjabir, Citaraho, Jinja, Tangawizi, Ata-le, Jinja. FURTHER INF  Scientific synonyms: Z. zingiber, Z. blancoi, Z. majus, Amomum zingiber. Ginger is mainly cultivated in the tropics from sea level to 1500 m and it thrive in hot, moist conditions, but can be grown over more diverse conditions than most other spices. Ginger originated in South East Asia, but is nowhere known in a wild state. When grown on slopes the production may result in severe erosion unless adequate soil-conservation methodes have been employed. Low temperatures will induce dormancy. The expected yield of dried ginger may be 1.5-7.5 t/ha. The dried ginger constitues about 25% of the raw rhizome's weight. Yields of green ginger can be up to 38 t/ha."
10981,Zea mays ssp. saccharata,BRIEF DESCRIPTION
238663,Zea mays ssp. mays,"BRIEF DESCRIPTION  A tall, coarse grass and grain crop up to 40-700 cm with strong erect stalks and long narrow leaves. USES  It is mainly grown for food and fodder. The grain is ground to flour and used in starchy foods and breads. It is used in breakfast foods, i.e. corn-flakes. Fermented grain is made into wiskey and industial alcohol. Corn starch is used in cosmetics, adhesives, glucose, and syrup. Oil is extracted from the seed embryo and used as salad oil, and to make linolium, paints, varnishes, soaps, glycerine, and high fructose syrup. Mentioned as a useful agroforestry species. GROWING PERIOD  Annual. In Kenya quick-maturing lowland varieties flower in 60 days and mature in 120 days, varieties grown between 1200-2100 m in elevation flowers in 105 days and mature in 210 days, while varieties grown at 2100-3200 m may take 195 days to flower and more than 365 days to mature. In the United States corn on average mature within 130-140 days and some cultivars only require 90 days. COMMON NAMES  Maize, Mais, Maiz, Sweet corn, Mealies, Corn, Green maize, Bok'olo, Indian corn, Blue corn. FURTHER INF  Maize can be found at elevations between sea level and 4000 m and it can be grown at latitudes from 48°N to 40°S. Photosynthesis pathway C4 III for tropical lowland and C4 IV for highland and temperate types. Hot, dry winds may reduce the amount of pollen available for fertilization and very humid conditions are not considered good for maize. Hail can do great damage to the crop. Since the crop leaves much of the ground uncovered, soil erosion and water losses can be severe. The optimum yield is 7-11 t/ha, world average 3.6 t/ha. High yields of maize make a heavy drain on soil nutrients and it has a high nitrogen requirement. The species is probably indigenous to Mexico and Central America. Some short-season varieties are able to develop with only 300 mm of rain."
