CropID,SciName,Info
227247,Pinus elliottii ssp. elliottii,"DESCRIPTION: It is an evergreen, coniferous tree reaching a height of 20-30 m. It has an extensive lateral root system and a moderate taproot. The typical tree has a straight bole and a narrow ovoid crown."
8628,Pinus durangensis,BRIEF DESCRIPTION
8627,Pinus douglasiana,BRIEF DESCRIPTION
8626,Pinus chiapensis,SOURCES (P. chiapensis (Martinez) Andresen)
8622,Pinus caribaea ssp. caribaea,"BRIEF DESCRIPTION  A needleleaf, evergreen, coniferous tree usually reaching a height of 20-30 m and a trunk diameter of 30-60 cm. SES  Wood utilized for general utility lumber, construction, boat building, veneer, pulpwood, posts, and firewood. Oleoresin is extracted from old stumps. The tree is palnted as an ornamental. Mentioned as a possible agroforestry species.  GROWING PERIOD  Perennial. COMMON NAMES  Carribean pine, Pino caribea, Pino macho, Pino amarillo. FURTHER INF  This Carribean pine is indigenous to western Cuba and the Isle of Pines. It can be found at elevations from sea level to 1000 m. The tree occur naturally within the latitudinal range of 21-22.5°N. The tree tolerates salt winds. Annual wood production potential is 10-20 m3/ha."
8623,Pinus caribaea ssp. hondurensis,BRIEF DESCRIPTION
8621,Pinus caribaea ssp. bahamensis,"BRIEF DESCRIPTION  A needleleaf, evergreen, coniferous tree usually reaching a height of 15-20 m and a trunk diameter of 30-50 cm. USES  Wood utilized for general utility lumber, construction, boat building, veneer, pulpwood, posts, and firewood. Oleoresin is extracted from old stumps. The tree is palnted as an ornamental. Mentioned as a possible agroforestry species. GROWING PERIOD  Perennial. COMMON NAMES  Bahaman pine, Yellow pine, Carribean pine, Pitch pine, Pino de la costa, Pino colorado, Ocote blanco. FURTHER INF  Scientific synonym: P. bahamensis. This Carribean pine is indigenous to the Bahamas and Caicos Islands. It can be found at elevations from sea level to 1000 m. The tree occur naturally within the latitudinal range of 21-27°N. The tree is windfirm and tolerates salt winds. Annual wood production potential is 10-28 m3/ha."
1691,Pinus caribaea,"DESCRIPTION: It is a fine evergreen tree usually reaching 20-30 m in height but often up to 35 m, with a diameter of 50-80 cm and occasionally up to 1 m. The trunk generally straight and well formed. USE: The wood is used as pulp for paper and as fuel. However, it throws out sparks when burning. It can be tapped for rasin and the bark contains tannin. The leaf oil is sometimes used for medicinal baths, locally, the seeds may be consumed. In many places where the tree grows, the mat of needles on the ground is considered valuable for the protection of the soil surface from erosion. In Sri Lanka a massive reforestation programme was undertaken with the tree convert heavily eroded lands on which nothing else could be grown. It is the only species so far successfully used to clothe barren eroded and denuded lands with a tree cover. GROWING PERIOD: Perennial. COMMON NAMES: Caribbean pine, Caribbean pitch pine, Nicaragua pine, pitch pine, slash pine. FURTHER INF: It grows best in frost-free areas up to about 700 m in more fertile sites with good subsoil drainage and annual rainfall of 2000-3000 mm. Soils are usually loams or sandy loams, sometimes with high amounts of gravel and generally well drained. The pH is usually between 5.0 and 5.5. Generally at elevations of 600-800 m it is associated with P. oocarpa var. hondurensis and P. oocarpa var. ochoterenai. Pinus caribea is rated as moderately fire resistant. It tolerates salt winds and hence may be planted near the coast."
8619,Pinus brutia,"BRIEF DESCRIPTION  A needleleaf, evergreen, coniferous, medium-sized to tall pine tree reaching 12-36 m in height. It has a straight trunk and a thin irregular spreading crown. USES  The timber is used for carpentry, ship planking, particle-board, and weneer. The tree also provides firewood and it is grown as an ornamental. KILLING T  Very frost resistant. GROWING PERIOD  Perennial. COMMON NAMES  Brutia pine, Calabrian pine, Cyprus pine, Maindano, Kadi. FURTHER INF   Scientific synonym: P. halepensis var brutia or var pityusa , P. pityusa. Brutia pine can in tropical regions be found at elevations from 1000 to 2500 m. In subtropical regions it can be grown from sea level up to 1500 m. The tree occur naturally within the latitudinal range of 33-45°N. It is indigenous to the hills of southern Turkey, northern Syria, and northern Iraq. The tree is termite and fire resistant. Annual wood production potential is 2-6 m3/ha."
8616,Pinus ayachuite var. Br.,BRIEF DESCRIPTION
8620,Pinus canariensis,"DESCRIPTION: It is an evergreen, coniferous tree reaching 20-40 m or even up to 60 m in height. Needles densely crowded giving the tree a tufted appearance, bark furrowed, reddish brown. USE: Timber used for construction purposes. The bark yields resin and the tree is grown for shelter. GROWING PERIOD: Relatively slow growing perennial. COMMON NAMES: Canary Island Pine, pino Canario. FURTHER INF: It can be found at elevations from 400 to 2500 m, most common between 600-2000 m. The tree occur naturally within the latitudinal range of 27.5-29°N. The tree can reach a height of 20-30 m. The tree is drought hardy, fire resistant and tolerates salt winds. Annual wood production potential is 8-18 m3/ha."
1702,Pinus oocarpa,BRIEF DESCRIPTION
8615,Pinus ayacahuite,BRIEF DESCRIPTION
8595,Pimpinella anisum,"BRIEF DESCRIPTION  A pubescent herb about 50-60 cm high with small yellowish flowers in compound umbels. USES  The seeds are a source of oil and spice. The oil is used in perfumery, soaps, beverages and it has medicinal properties. Anise seed are used to flavor curries, sweets, and certain liqueurs. KILLING T  Germinating plants can tolerate -7°C. GROWING PERIOD  Annual. The germination time of the seeds is 17-25 days, stem emergence and development of flowers 65-75 days, flowering and seed development 20-25 days, and ripening of seeds 20-25 days.  COMMON NAMES  Anise, Aniseed. FURTHER INF  Anise does not grow satisfactorily in tropical lowlands. The plant is 60-150 cm heigh. It is indigenous to the eastern coast area of the Mediterranean, to Asia Minor, and to Egypt. For the development of 100 kg seed the plants take up 3.5 kg of N, 1.5 kg of P2O5 and 4 Kg of K2O. Optimum yield of seed is 1.5 t/ha. Mentioned as a useful agroforestry species."
8594,Pimenta racemosa,"BRIEF DESCRIPTION  A small tree reaching a height of 7-10 m. It has obovate leathery leaves. USES  The aromatic fruits, bark and especially the leaves are processed for use as a spice. The leaves provides bay oil that is used in perfumery and in bay rum. The fruit and bark are minor sources of dried spice or essential oils. GROWING PERIOD  Perennial tree. COMMON NAMES  Bay, Bay rum tree. FURTHER INF  Scientific synonym: P. acris. Bay is native of Central America and the Caribbean region. Mentioned as a useful agroforestry species."
1689,Pimenta dioica,SOURCES
8571,Picea abies,"DESCRIPTION: Norway spruce is an evergreen tree reaching a height of 30-60 m. The bole is usually straight and symmetrical, with no tendency to fork. The root system is typically shallow, with several lateral roots and no taproot. On rocky sites the roots spread widely, twining over the rocks. On bog soils, it tends to form plate-like roots. USE: The wood is strong, soft, straight- and fine-grained, and easily worked. It is not durable in contact with soil. It is widely used for construction, pulp, furniture, and musical instruments. Planted in shelter belts and as an ornamental. GROWING PERIOD: Perennial. COMMON NAMES: Norway spruce (England), Gran (Norway), Rød gran (Denmark), Metsäkuusi (Finland), Fichte (Germany). FURTHER INF: It grows best in cool, humid climates on rich soils. Preferred soils include well-drained sandy loams. It also grows well on almost all other types of soils. Permanently waterlogged soils inhibit growth, but it does occur on poorly drained soils and in bogs. Growth rates increase with increased soil organic material and are positively correlated to the nitrogen content of the soil. Soil pH often ranged from 3.7 to 4.4. It occurs at elevations up to 2000 m in the Bavarian Alps. It is tolerant of shade but not very wind firm."
28399,Phytolacca dioica,"DESCRIPTION: It is a spreading deciduous or evergreen tree, 6-10 m in height, with a domed crown. Trunk erect, stout, uniquely swollen at the base, which may grow to 4 m in diameter, spreading above the ground so that the tree appears to be standing on a mound. Leaves simple alternate, typical of the family, appearing as terminal whorls. USE: Leaves are used as fodder in times of drought. However, fruits should be considered potentially toxic to livestock. The seeds, leaf and root contain saponins. The fruit has been used as a human emetic and purgative; an infusion of the leaves also acts as a purgative. The tree is planted as an unusual ornamental around Nairobi and elsewhere in the highlands of Kenya and provides excellent shade. GROWING PERIOD: Perennial. COMMON NAMES: bella sombra, belombra, pokeweed. FURTHER INF: It is a tree for mild climates, undemanding in soil fertility and resistant to sea winds. The tree is reputed to grow rapidly to its preferred height but is fairly aggressive in gardens, with root suckers appearing readily above the soil. It is resistant to locusts and ants and will withstand hurricanes and prolonged heat and drought."
8556,Physalis philadelphica,"BRIEF DESCRIPTION  A herb reaching 15-60 cm in height. The fruit is 12-60 x 10-48 cm and surrounded by a calyx. USES  The fruit is edible and used in chili sauces and meat dressings. The plant is occasionally grown as an ornamental. GROWING PERIOD  Annual. COMMON NAMES  Tomatillo, Husk-tomato, Mexican husk tomato, Jamberry, Ground cherry, Tomatillo ground cherry, Tomate de cascara, Tomate de fresadilla, Tomate milpero, Tomate verde, Miltomate. FURTHER INF  Scientific synonym: P. ixocarpa. Tomatillo occur in Mexico and Guatemala at elevations from near sea level to 2600 m. (pH estimated by the compiler)."
8565,Phytolacca acinosa,"
It can be found in forests, light woodland, shrubbery, "
8576,Picea morida,SOURCES
1686,Physalis peruviana,"BRIEF DESCRIPTION  A herbaceous shrub usually reaching up to 0.5-2 m in height and 2 m in diameter, with spreading branches. The fruit is a globose berry, 1-2 cm in diameter, orange-yellow, enclosed in an inflated calyx or husk. USES  Fruits are eaten fresh, whole or sliced, mixed in fruit salad and fruit cocktails, used for jams and preserves, or stewed and used in pies, puddings, chutneys, and ice-cream. They are a good source of vitamins A, C, and B complex, protein, phosphorous, and iron. The leaves have medicinal properties. KILLING T  Tolerant of light frosts. GROWING PERIOD  Perennial, normally grown as an annual. Flowering occurs 65-75 days after planting and first fruits may be harvested after about 80-100 days. The plant flower year-round in frost-free areas. The full economical life is about 2-3 years. COMMON NAMES  Goldenberry, Cape grooseberry, Ground tomato, Ground cherry, Husk tomato, Peruvian cherry, Tang lung kwoh, Ceylon-gooseberry, Ketembilla, Quetembila, Topotopo, Uchuba, Cuchuva, Uvilla, Cappuli, Uchuva, Aguaymanto, Amor en bolsa, Cereza del Peru, Cuchuva, Lengua de vaca, Motojobobo embolsado, Sacabuche, Tomate silvestre, Yuyo de ojas, Giant ground cherry, Peruvian groundcherry, Peruvian cherry, Poha, Jam fruit, Physalis, Ananaskirsche, Essbare Judaskirsche, Kap-stachelbeere, Lampion, Coquerelle, Coqueret, Coueret du Perou, Alkeken"
8544,Phyllocladus aspleniifolius,"BRIEF DESCRIPTION  A medium sized to tall tree, reaching 20-30 m in height, and the trunk, 1 m in diameter. The tree usually have a straight trunk, dark bark, and a rather dense dark-green crown. USES  Timber used for railway sleepers, strainer posts, boat building, truck and house flooring, jonery, and chemical vats. GROWING PERIOD  Perennial. COMMON NAMES  Celery top pine. FURTHER INF  The latitudinal range in Tasmania is 41-43.5°S, and the tree usually occur at elevations between sea level and 800 m but can be found up to 1000 m. It is common on undulating country but occurs on a wide rang of topography. It prefers cool, moist, well-composted soil, and a protected semi-shaded position. It does not grow in waterlogged conditions."
1676,Phragmites karka,GROWING PERIOD
8533,Phragmites communis,BRIEF DESCRIPTION
8530,Phormium tenax,"BRIEF DESCRIPTION  A herb with a short, fleshy, creeping, branched rootstock which put up collections of tough, sword-shaped leaves growing rather in the form of a fan. The plant may reach a height of 2-5 m. USES  Grown as a fiber crop. The leaves contain 10-14% fiber that are used for twines, ropes, matting, woolpacks, and padding. GROWING PERIOD  Perennial. First harvest may be made when the plants are 5-6 years old with subsequent harvests every 4-6 years. COMMON NAMES  New Zealand flax, New Zealand hemp. FURTHER INF  New Zealand flax is native of New Zealand and the Norfolk Island. It is not suited to hot tropical lowlands. In the subtropics, it is grown at elevations between sea level and 1300 m. It occur on almost any kind of soils but best result is obtained on wel drained alluvial soil in the vicinity of swamps or rivers. A good yield is 75 t/ha of green leafs at each harvest, 9 tons of green leaf produce 1 ton of fibre."
8524,Phoenix reclinata,"DESCRIPTION: It is an evergreen palm reaching 10-12 m in height. Stem about 25 cm in diameter, may be straight or curved, sometimes swollen at the base, with a dense mass of pencil-thick roots arising from the lower part. Crown consists of 15-30 live leaves, of these 10-20 are dead and dying ones. Fruits borne in large, drooping bunches, individual fruit oval, orange to reddish- or yellow-brown, up to 2.5 cm long, fleshy, datelike with a rather insipid but edible flesh. USE: Buds may be eaten raw or cooked as a vegetable. The heart of the crown is eaten, and the fruit is also edible. Leaves are eaten by elephants, and the fruit is food for many wild animals. Wood is used as charcoal, the leaves yield fibre and dye and the roots tannin. It is planted for erosion control and can be very effective if planted as a specimen tree on a lawn, to line the sides of a road or to fill a large opening in a large garden. GROWING PERIOD: Perennial. COMMON NAMES: coffee palm, wild date palm. FURTHER INF: It is a clump-forming palm, it may be solitary but is usually found growing in colonies. Grows throughout tropical Africa in humid lowland woodlands, highland forests and on open, rocky hillsides. Occasionally it grows in grasslands with a high water table. Throughout Zambia the species is essentially a swamp or riverine species and is found in considerable concentrations around Lake Bangweulu. It is also found around anthills, on boggy dambos, in munga woodland on the Kafue Flats and in the Kalahari woodland. Outside Zambia its range extends from Senegal across West Africa to Ethiopia, and over the whole of eastern and central Africa to Botswana and the Cape. It is drought resistant and prefers full sun but also thrives in light shade. It is a protected species in South Africa."
1673,Phoenix dactylifera,"BRIEF DESCRIPTION  A evergreen tree (palm) reaching 15-40 m in height with a terminal crown of 100-120, 4-7 m long pinnate leaves. USES  The fruits are usually eaten fresh or dried. Date pulp is a good source of calcium, phosphorous, and carbohydrates. Palm trunks can be tapped for a sap taht is made into palm wine. Palm leaves have been used as thatch and fiber. KILLING T  Leaves may tolerate -4 to -6°C and the tree -15°C. GROWING PERIOD  Perennial. Begin fruiting within 2-4 years and normally reach full production at 5-8 years, (Rice; 8-10 years) but productivity may increase up to 9-15 years. Yields decline after 40-50 years, but the tree will continue to produce up to about 75 years. COMMON NAMES  Date, Palmier dattier, Datilera, Dattelpalme, Khajur, Khaji, Thinbaw thinbaung, Tamareira, Palmera, Datilera. FURTHER INF  The tree transpires large quantities of moisture and the amount of available rainfall is often little, or entire absent in the production areas. The water requirement of the palm must be provided for by ground water (the roots of the tree can reach 2-6 m deep) or by irrigation. Irrigation is needed about every 14 days in the summer and 20-30 days in the winter. The water requirement of the palms is about 10000-50000 m3/ha per year, or 1.5 m3 per palm per week as an average over the year. Relative humidity should be between 40 and 50% during ripening time. Rain during flowering can hinder the pollination and rain during the fruit development can lead to bursting and dacay of the fruit. An average well-managed palm can produce about 60-70 kg of fresh dates per year. The palm can be grown at elevations between sea level and 1500 m. Mentioned as a useful agroforestry species."
8516,Phleum pratense,"BRIEF DESCRIPTION  A bunch grass reaching 75-115 cm in height, with a dense spikelike inflorescence. The sods are open and relatively thin and frequent defoliation soon weakens the plants and result in there destruction in a few years. USES  Grown for pasture and hay. GROWING PERIOD  Long-lived perennial. COMMON NAMES  Timothy, Common Timothy, Mountain Timothy, Herd`s grass. FURTHER INF  Timothy requires a cool and moist climate. Dry matter yields may vary between 4.5-11 t/ha."
8526,Phoenix sylvestris,"DESCRIPTION: It is a fast growing, evergreen and ornamental palm reaching up to 4-8 or 12-15 m in height. USE: The sweet fruits is edible. The leaves can be used as roughage for milk cattle. Date sugar is obtained from its sap and refined into sugar or fermented into alcohol. The trunk is used in the construction of houses. The fruit is good in heart complaints, abdominal complaints, fevers, vomiting and loss of consciousness. The juice obtained from the tree is considered to be a cooling beverage. The roots are used to stop toothache. The fruit pounded and mixed with almonds, quince seeds, pistachio nuts and sugar, form a restorative remedy. The central tender part of the plant is used in gonorrhoea. It is an ornamental tree and can also be used as an avenue plant. GROWING PERIOD: Perennial. COMMON NAMES: Date-sugar palm, Dushpradarsha, Indian wild date, Indian winepalm. FURTHER INF: It can be found in India, Bangladesh, Nepal, Myanmar, Pakistan, Australia and in the Ivory Coast. It is gregarious in many parts of India. It is commonly found on low ground in the sub-Himalayan tract, along along river banks and on stretches of low ground. It can be found in open tropical rainforest, open forest and grassland. It can grow in a wide range of soil types but prefers sandy well drained but moist soils. It will not survive in wet or badly drained soils."
8532,Phragmites australis,"BRIEF DESCRIPTION: A rhizomatous, stoloniferous grass reaching a height of 2-4 m. Leaf-blades flat, smooth, 15-45 cm long and 1-5 cm wide. USES: Used for pasture it cannot stand prolonged heavy grazing. For maximum production no more than half of the current year's growth should be grazed off. Palatable when young becoming tough and unpalatable after maturity. Can be used to stabilize banks and drains against erosion in non-agricultural areas. Also used for temporary roofing, lattice work, matting, sandals, pens, paper and arrows. The reed can be used also for the preparation of absolute alcohol, feed yeast and lactic acid. Young buds can be eaten in salads and the sprouts may have medicinal properties. GROWING PERIOD: Perennial grass. COMMON NAMES: Common reed, Carrizo. FURTHER INF.: Scientific synonyms: P. communes, Trin, P. vulgaris, B.S.P. The natural habitats of common reed are swamps, drains and moist headlands. It has an aggressive root system and can become a weed in drains and irrigation channels. Tolerates considerable flooding. Native to Eurasia, Africa, but now widespread throughout the world; throughout United States, Mexico, West Indies to Chile and Argentina, Australia."
1668,Phaseolus vulgaris,"BRIEF DESCRIPTION  A slightly pubescent, erect, herbaceous bush or twinning vine with well developed tap-root. Stem angular or nearly cylindrical, leaves trifoliate and flowers white, pink, lilac or purple. Bush cultivars are dwarf plants 20-60 cm tall with lateral and terminal inflorescences. Climbing cultivars may reach a length of 2-5 m. The pods are 10-20 cm long, containing 4-6 seeds or more. USES  This bean is grown for food. The bean pods are often sold in processed forms, usually frozen, canned, or dehydrated. The seeds can be processed into dry flour or eaten boiled, baked or fried. They are good source of protein, vitamin B, and iron. Immature pods are eaten as vegetables. Leaves can be used as a potherb. The plant is used as forage. Leaves and fruits have medicinal properties. KILLING T  Flowers are damaged at 5°C or below and the plant is killed by frost. GROWING PERIOD  Annual, growing 50-90 days for fresh beans, and 90-270 days for dry beans depending on variety and altitude. COMMON NAMES  Common bean, French Bean, Kidney Bean, Runner Bean, Snap Bean, String Bean, Garden Bean, Green Bean, Haricot bean, Bush bean, Navy bean, Pole bean, Harcot a couper, Harict, Haricot commun, Haricot pain, Haricot vert, Judia, Frijol comun, Bohne, Frash bean, Rajmah, Vilaiti sem, Kachang bunchis, Kachang merah, Bonchi, Buncis, Boontjis, Bo-sa-pe, Pe-bya-gale, Pegay, Sandaek barang, Thwax falangx, Tua kack, Tua kheak, Tua phum, Dau ve, Butingi, Habichuela, Mula, Adagora, Ashanguare, Fajola, Zada-adagonna, Chilemba, Chimbamba, Manawa, Edihimba, Maharage, Ojoo, Caraota, Frijol, Fasolia, Wake, Akidi, Okwe, Haragwe, Haragi, Awuje, Habichuela, Poroto, Chumbinho opaco, Icaraota, Pinto bean, Porotillo, Princess bean. A popping type of common bean grown in the Andean mountains are known under following names; Nunas, Popping beans, Popbeans, Numia, Nudia, Hudia, Kopuro, Chuvi, Poroto, Purutu, Porotillo. FURTHER INF  Common bean is probably native to tropical South America. It can be found at elevations from sea level to 3000 m, most cultivars thrives between 600 and 2000 m, but cultivars for tropical sea level exist. Popping beans are grown between 1800 and 3000 m in the Andean mountains. Common bean require medium to high humidity especially at flowering, but to high humidity will, like poor drainage, generally result in disease problems. Hail can cause serious defoliation and loss of the crop. For harvesting, drying and threshing of the beans dry weather is required. Photosynthesis pathway C3. To acid soils should be avoided since the reduce the activity of the Rhizobium nitrogen fixing bacteria. Common bean is not as efficient as many other legumes in utilizing the nitrogen-fixing Rhizobium bacteria which inhabit the root system. The average yield of dried beans is 0.5-1.5 t/ha, but yields up to 2.8-5 t/ha have been reported. Yields of green pods of up to 5-7.5 t/ha have been reported."
2525,Phaseolus polyanthus,"BRIEF DESCRIPTION  A legumenous herb with white or lilac flowers. USES  The green seeds are eaten in soups, stews or as a sweet. GROWING PERIOD  Annual or perennial with a lifespan of 2-4 years. COMMON NAMES  Botil, Piloya, Dzich, Piligue, Petaco, Cacha, Matatropa, Toda la vida. FURTHER INF  Botil occurs in parts of Central America and the Caribbean at elevations between 800-2600 m in cool, damp climates with one dry period per year."
