CropID,SciName,Info
7647,Medicago arabica,"BRIEF DESCRIPTION  A procumbent or ascending, herbaceous legume reaching 10-60 cm in height with a purplish black central spot on the leaves, yellow flowers and discoid glabrous pods. USES  It is used for pasture, erosion control, and soil-improvement. It makes a good winter pasture. GROWING PERIOD  Annual, grown as a winter annual in subtropical areas. Sown in spring the crop may mature in about 120 days but sown in early autumn it may require up to 200 days. COMMON NAMES  Spotted burclover, Southern burclover, Spotted medic, Heart medic, Heart trefoil, Southern bur clover, Luzerne d'Arabie, Luzerne hongroise, Luzerne maculee. FURTHER INF  Scientific synonym: M. maculata, M. polymorpha, M. arabica. Spotted burclover is probably native of southern Europe, it occur in central and southern Europe,  around the Mediterranean and in western Asia and has been introduced in North and South America and Australia. It is common on coast near sites and in woodlands between sea level and 850 m in elevation."
7639,Mauritia flexuosa,"BRIEF DESCRIPTION  An evergreen tree (palm) growing up to 15-40 m tall. USES  A fiber crop. The fiber is primarily used for cordage. The fruit can be made into wine through a fermentation process. The pulp of the fruit is edible. ROWING PERIOD  Perennial. COMMON NAMES  Buriti palm, Miriti, Morete, Moriche, Acho, Achual, Achul, Aeta, Aguage, Aguaschi, Aguashi, Arbol de la vida, Awuara,Bache, Biriti, Boriti, Bororo, Brutti, Buri, Bruiti do Brejo, Burritisol, Burity, Burity do brejo, Bury, Cananguchi. FURTHER INF  Scientific synonym: M. vinifera. Mauritia belong to the palm subdamily Calamoideae. Buriti palm is native of northern South America east of the Andes. In the Amazonian lowland, it can be found at elevations between sea level and 970 m. Mentioned as a useful agroforestry species. In areas with less the 2000 mm of annual rainfall, or with a dry season, water must be avaiable throughout the year."
7637,Matricaria recutita,"BRIEF DESCRIPTION  A herb with yellow-white flowers reaching a height of 50-80 cm. USES  The herbal tea made from the inflorescence has anti-inflammatory, antispasmodic and aniseptic properties. Also the leaves are used in herbal teas, as a mild sedative. Flower heads provide a nerve tonic that induces sweating and treats upset stomachs. An essential oil is used in perfumes, shampoos, liqueurs, tobacco, and confections. KILLING T  It is not sensitive to winter frost in the rosette stage, but will be damaged by spring frosts in the period of thickening. GROWING PERIOD  Annual overwintering herb. In Hungary it is sown in August-September and harvested next spring when most of the flowers are in full bloom. COMMON NAMES  German camomile, Matricaria, Hungarian camomile, Wild camomile, Sweet false chamomile, Bahboonig, Msolo. FURTHER INF  Scientific synonyms: M. chamomilla, M. suaveolens, Chamomilla recutita. German camomile is probably native of the eastern Mediterranean region. The northern border of its range is 63-64°N. The plant can reach a height of 50-80 cm. The average yield is 0.5-2 t/ha of fresh flowers, from which 0.1-0.5 t/ha of dry drug can be produced. With mechanized harvesting, 4-8 t/ha of flowery stems can be harvested for the production of essential oil."
18215,Marsilea quadrifolia,"DESCRIPTION: It is a deciduous aquatic fern reaching 15-20 cm in height. From creeping rhizomes, thin green stalks rise to the water surface, each stalk bearing a single shamrock-like leaf with four wedge-shaped leaflets. It forms dense stands or random growing pattern. USE: It is used as food in Cambodia and in Australia it is much relished by livestock. It has medicinal properties and is used as an ornamental plant both in garden ponds and in aquariums. GROWING PERIOD: Perennial. COMMON NAMES: Water shamrock, Water clover, European pepperwort. FURTHER INF: It can be found in shallow water of lakes, ponds, or quiet sections of rivers and streams and on wet shores. It is tolerant to a range of water conditions and requires a permanently moist or wet soil and thrives on muddy ground, loam or peat. It is native to Europe and was introduced to America in 1862 where it has escaped cultivation and naturalized in much of the north-eastern United States from Florida to Pennsylvania and west to Iowa and Missouri. In Asia it is found from Japan and China to Cambodia and Australia."
7618,Marrubium vulgare,"BRIEF DESCRIPTION  A spreading herbaceous plant reaching a height of up to 70 cm. A fibrous, spindle-shaped rootstock sends up numerous bushy, square, downy stems. It has white, pubescent, roundish-ovate leaves and continually blooming small white flowers. USES  The leaves and stems can be boiled and used in the preparation of candied products, cough drops and syrups. Extracts are used in bitters and liqueurs and has medicinal properties. GROWING PERIOD  Perennial herb. The crop is harvested and dried just prior to open bloom. Cultivated stands, which generally last for 4-5 years, can be cut two or three times each year. (GMIN and GMAX estimated by the compiler). COMMON NAMES  Horehound, Common horehound, White horehound, Hoarhound. FURTHER INF  Horehound is native of central and western Asia, southern Europe and northern Africa. Average yield is 2-3 t/ha of dry drug."
248814,Markhamia lutea,"DESCRIPTION: It is an upright evergreen tree 10-15 m high, with a narrow, irregular crown and long taproot. Bark light brown with fine vertical fissures. Leaves compound, often in bunches, thin and wavy, each leaflet up to 10 cm, wider at the tip, often with round outgrowths at the base. Flower buds yellow-green and furry, splitting down 1 side as flower emerges. Flowers bright yellow, in showy terminal clusters, each trumpet shaped, to 6 cm long, with 5 frilly lobes, the throat striped with orange-red. USE: The flowers provide good bee forage. The wood, which is fairly resistant to termites, is used for furniture, poles, posts, tool handles and boat building and also as firewood and charcoal. Leaves are known to have medicinal value. The tree is useful for erosion control, shade and shelter. It provides mulch, which enhances soil-moisture retention and increases organic matter. Attractive and worth planting as a screen or background tree for gardens and on golf courses.GROWING PERIOD: Perennial. COMMON NAMES: markhamia. FURTHER INF: It is common in the lake basins and highland areas of eastern Africa. The tree is drought resistant but cannot withstand waterlogging."
2335,Maranta arundinacea,"BRIEF DESCRIPTION  An erect, glabrous herb with a slender stem and ovate oblong leaves 10-15 x 3-10 cm reaching up to 1-1.5 m in height, and with a shallow root system and rhizomes penetrating more deeply in the soil. USES  It provides starch used in jellies and pastes and is often part of infant or invalid food because it is highly digestible. The starch is also used as a base for face powders and in certain types of glue. It counteracts insect stings and also has several medicinal uses. A fibrous debris from the rhizomes is fed to cattle. GROWING PERIOD  Perennial. Flowers about 90 days after planting and the rhizomes are mature after 300-365 days. Successive crops are usually grown on the same land for 5-6 years. COMMON NAMES  Arrowroot, West Indian arrowroot, Arruruz, Cara maco, Sagu, Yuquilla. FURTHER INF  Arrowroot is native of South America. It produces better crops in the lowlands, but can be grown at altitudes of up to 1000 m. Yields may within 5-6 years be between 10-35 t/ha of rhizomes, from which 2.5-7.5 t/ha of starch can be obtained. Friable soils are preferred for better tuber development and easy harvesting. Mentioned as a useful agroforestry species."
2334,Manilkara achras,"BRIEF DESCRIPTION  A much branched, slow growing, evergreen, small to medium sized tree. Under cultivation the tree usually reaches 9-20 m in height and up to 50 cm in diameter. As a forest tree it can attain heights of 30-38 m with diameters of up to 150 cm. USES  The fruit is eaten fresh, used to flavor ice cream, and made into syrup and jam. A milky latex from the bark is used in chewing gum. The fine, hard wood is used to make various wooden articles. The tree is mentioned as a useful agroforestry species. KILLING T  Young trees may be killed by -1°C, but older trees can survive temperatures as low as -3 to -4.5°C for some hours. GROWING PERIOD  Perennial. The tree begins to fruit 3-4 years after planting and yields increase up to 25-30 years. The fruit takes about 120 days to mature from flowering. Latex are obtained by tapping the trunk once every 2-3 years. COMMON NAMES  Sapodilla, Chicle, Chicle tree, Dilly, Naseberry, Marmalade plum, Nispero, Tree tomato, Small sapote, Sawo, Sapotille, Nefle d'Amerique, Zapotillo, Chicozapote, Nispero, Chico, Chicopote, Chicku, Chico, Sapote, Sapote amarillo, Sapota, Chika, Sapoti, Talalog, Sapote a gomme, Sapodilla plum, Surinam medlar, Breiapfel, Sapotaapfel, Nisporo de Nicaragua, Zapote de abeja, Zapote de chicle, Bully tree, Sapotilha, Nisperd, Chiku, Ciko, La-mut-farang. FURTHER INF  Scientific synonyms: M. zapota, M. zapotilla, Achras sapota, Ackras Cosaguigo, A. zapodilla, Nispero achras, Sapota achras, Calocarpum spp, Lucuma nervosa. Sapodilla is a native of Central America. It thrives near the seashore in the humid tropical lowlands below 500-900 m, but can be found up to 2500 m in elevation and can also be grown in some subtropical regions. It does not like a hot dry summer, but is quit drought resistant. The tree is salt sensitive, though it withstands salt sprays close to the sea and can be grafted on rootstocks of M. hexandra to allow fruit production on saline land. With its tough branches the tree tolerates strong winds, but on sandy soils the tree can be uprooted by the wind. A good tree may yield up to 2500-3000 fruits per year or about 250-300 kg. Annual yields per ha of 20-30 t have been reported in Florida, 20-25 t in the Philippines and 20-80 t in India."
1420,Manihot esculenta,"DESCRIPTION: An erect shrub with an upright woody stems reaching a height of 4 m or more. The mature tuber may measure 1 m in length and weigh up to 2 kg. The cassava plant may be divided into two main parts: the shoot system, which consists of stem, leaves and reproductive structures or flowers; and the root system, which consists of feeder roots and tubers. The fleshy elongated tuberous roots or rhizomes, are very woody, only slightly thickened in wild varieties; under cultivation up to 2.5 m long and 10-15 cm in diameter, weighing up to 40 kg, averaging 4-7 kg; leaves usually deeply 3-7-parted with spatulate to linear-lanceolate acuminate lobes 7.5-15 cm long, glabrous, glaucous beneath and minutely puberulent along veins, long petioled; flowers in panicles, less than 1.2 cm long; capsules globose, about 1.2 cm across, with 6 winged angles; seeds 3 per capsule. USES: Cassava provides a major source of calories for poor families, because of its high starch content. With minimum maintenance, the farmers can dig up the starchy root of the cassava and eat it 6 months to 3 years after planting. Thus, people can cultivate cassava during times of conflict or natural disaster when no other food is available. The tubers have a high content of carbohydrates, phosphorous, iron, and calcium and are a valuable source of food. Cassava starch is used in cooking and cassava flour is used in puddings, biscuits and other confectionary. In Africa, people also eat the leaves of the cassava as a green vegetable, which provide a cheap and rich source of protein and vitamins A and B. (Young leaves are cooked like spinach). Various industries use it as a binding agent, because it is an inexpensive source of starch. Cassava starch is used in the production of paper and textiles and as monosodium glutamate (MSG), an important flavoring agent in Asian cooking. In Africa, cassava is beginning to be used in partial substitution for wheat flour, thus providing income to resource-poor farmers and saving foreign exchange for national Governments. The plant is also used in the production of adhesives, cosmetics, textiles, and paper. It is fed to livestock. Alcoholic beverages and ethanol for fuel are made from the tubers. The advantage of cassava for ethanol production is that the tubers may be stored in the ground for many months before processing; thus extending the factory window. KILLING T.: May not tolerate 7°C for prolonged periods and it is easily killed by frost. GROWING PERIOD: Short-lived perennial. Mature leaves may be harvested 50-70 days from insertion of the cuttings. The 'sweet' cassavas mature in 180-270 days, the 'bitter' in 12-18 months. Growing period 6-24 months, depending on cultivar and conditions. COMMON NAMES: Cassava, Manihot, Manioc, Tapioca, Guacomote Yuca, Cassave, Kelala, Marachini, Maravalli, Simul Alu, Ubi Singkong, Mangahazo, Ubi Kayu, Mun Sumpalung, Boodin, Kaspe, Katela, Bodin, Obi Kajoe, Poohoong Kahoy, Kamoteng, Tentu Neskok, Muk Shue, Pok Fung, Cassada, Aipi, Aipim Ubi, Ketalla, Macaxiera, Mandioca, Manoco, Ramu, Yautia. FUTHER INF.: Cassava is seldom grown above 1800 m in elevation in the tropics, maximum elevation for successfull cultivation is about 1000 m. Latitudinal range is 25°N to 30°S. Maximum tolerated slope is about 5°. The photosynthesis pathway is C3 II. Prefers moderate humidity. Tuber production is delayed and reduced in daylengths greater than 10-12 hours. Cassava is native to the countries between the Amazon region and southern Mexico. World production for 2004 was estimated at 204819995 metric tons. Production in Asia during the same period was 60492789 metric tons and in Africa 108974574. Area harvested in 2004: World 18051574 hectares Brazil 1754875 Congo 1842559 Indonesia 1255805 Nigeria 3531000 and Mozambique 1068500 hectares. Yields from small holders average 5-15 t/ha, but yields of up to 30 t/ha can be obtained. Scientists at two CGIAR research centers IITA and CIAT have developed elite varieties of cassava with improved qualities. IITA has discovered spontaneous polyploids in cassava, which are characterized by enormous vigor and variation in form and structure. Selections from triploids ""super cassava"" have doubled the yields of existing improved varieties with normal chromosome numbers. IITA has also introduced to Africa a wider genetic base for cassava improvement, focusing on materials with resistance to mites, mealybugs, cassava bacterial blight, tolerance to drought, low cyanogen potential, and good cooking quality. Together, IITA and CIAT launched a biological control campaign of the mealybug and are cooperating with the International Fund for Agricultural Development (IFAD) in the formulation of a global development strategy for cassava."
1416,Mangifera indica,"BRIEF DESCRIPTION  An erect, branched, evergreen tree reaching 10-45 m in height, with a trunk diameter of 60-120 cm and a deep tap-root system. Fruit a fleshy drupe, very variable in shape, size and colour, usually ovoid-oblong, up to 30 cm x 10 cm and yellowish-green to reddish. USES  The fruit is a good source of vitamin A, it is eaten fresh or made into juice, squash, jams, jellies, or preserves. Unripe fruits are used in pickles, chutneys, and culinary preparations. The seeds are used as food or ground for flour. Leaves can be used as cattle feed. Timber is used in many ways and valued for boat building. KILLING T  A few hours of temperatures from -5 to 1°C may damage or kill bearing trees are damaged. Young trees and actively growing shoots are likely to be killed at -1°C. Flowers are not frost tolerant and fruits are liable to chilling injury at 4-10°C or 8-12°C, depending on the cultivar. GROWING PERIOD  Perennial. Seedlings may grow 3-7 years before first bearing and the tree may only produce one good crop every 3-4 year. Yields increase up to the 20th year, decline after the 40th year and the tree may live for 100 years or more. The fruiting cycle is 150-270 days and the time of development after fertilization to maturity of fruit is 60-150 days, depending on cultivar and temperature. COMMON NAMES  Mango, Ghari am, Am, Ambo amri, Manguier, Mamuang, Mangga, Mempelam, Ampelam, Mavena, Mavu, Amba, Ambo, Amra, Maa, Mamadi, Paho, Tharyetthi, Svaay, Mwangx, Xoai. FURTHER INF  Mango originates from the Indo-Burmese monsoon region. It thrives in both tropical and subtropical areas within the latitudinal range is 30°N to 25°S. It can for non-commercial production be grown at elevations up to 1200 m and up to 600 m for commercial production. It does best with strongly marked seasons in the tropical summer rainfall regions with dry weather and moderate humidity for flowering and fruiting. High humidity, mist and heavy dew promote fungal attack, while low humidity and drying wind can cause wilting and strong winds may destroy the crop. In areas with two wet seasons flowering and fruit production may occur twice each year, but normally only one crop per year is produced. Very fertile soils with adequate supplies of water thoughout the year may result in luxuriant vegetative growth and poor cropping. The trees are drought-tolerant and do not seem to suffer from occasional flooding. According to Purseglove even shallow and impervious soils produce mangoes, but for optimal conditions the watertable should be below 2-2.5 m. Photosynthesis pathway C 3 II. In the 10th year, a tree bears 400-600 fruits. A plantation of full-grown trees may produce 10-30 t/ha of fruit year. Average yields are, however often quit low e.g. in the Philippines 6 t/ha, in Peninsular Malaysia 3.5 t/ha and in Thailand 2.3 t/ha."
1414,Mammea americana,"BRIEF DESCRIPTION  A medium-sized evergreen tree reaching a height of about 20 m and a trunk diameter up to 1 m. The fruit is a globose to irregular berry, 10-20 cm in diameter and light-brown in colour. USES he fruits are eaten raw or made into salads, pies, tarts, marmelades, etc. or prepared into wine or juice. An insecticidal solution can be prepared from most parts of the tree, especially from the bark resin. The wood is hard and used as timber. Tannin can be extracted from the bark. Seed and leaves have medicinal properties. GROWING PERIOD  Perennial. Begin to bear 6 years after sowing. COMMON NAMES  Mammey apple, Mammee, South American apricot, Mamey americana, Mamey, Lucuma, Abricot des Antilles, Apricot d'Amerique, Mamey de Santo Domingo, Mammee, Abricotier sauvage, Abricot de Saint Domingue, Abrico do Para, Mamey colorado, Mamey zapote, Manggis negri, Aprikot. FURTHER INF  Scientific synonym: Patamocharis mamei. The mammey apple is native of the Caribbean region and northern South America. It thrive at elevations from sea level up to 1000 m, but are best grown in the lowlands. Good trees produce 300-400 fruits per year."
7557,Malva moschata,"DESCRIPTION: It is a herbaceous plant reaching 60-80 cm in height and 50-60 cm in width. A very ornamental plant, very variable in form, especially with regard to the degree of laciniation of the leaves. The scented white to pink or lavender flowers are 4-6 cm wide and hermaphrodite, in small, apical clusters. USE: The flowers, leaves and seed are edible and the seed and stems can be extracted for dye and fibre. All parts of the plant have medicinal properties and the plant is grown as a garden ornamental. GROWING PERIOD: Perennial but short-lived. COMMON NAMES: Musk mallow, Malva almizclada, White mallow. FURTHER INF: It can be found in a variety of disturbed habitats such as fields, empty lots, and along roadsides and in grassy places, pastures, meadows, hedgerows, woodland etc. The plant can tolerate strong winds but not maritime exposure. In North America it can be found in southern Canada southward to Oregon and California in the West and Wisconsin and Virginia, United States in the East. In Europe it occurs from southern Scandinavia in the North to northern Mediterranean in the South and from Ireland in the West to Poland in the East. In North America it can be found between 43-48°N and in Europe between 40-60°N."
220867,Malva alcea,"DESCRIPTION: It is a perennial, herbaceous plant reaching up to 90-120 cm in height and 30-70 cm in width. It has deeply lobed leaf margins, the lower leaves being palmate with 5 indistinct lobes and the upper pinnate. The flowers are 3.5-5 cm wide, hermaphrodite with five petals and white or pink. Petals deeply notched at the tip and with vague, darker lines. "
1410,Malus sylvestris,"BRIEF DESCRIPTION  A small deciduous tree often trained to a central lead or a delayed open center form reaching a height of 3-6 m. USES  The fruit can be eaten fresh, or used to make cider, soft drinks, juice, and vinegars. Pectine is a valuable by-product of cider. The wood is hard and strong and used for quality tool handles and firewood. KILLING T  The tree may tolerate -26 to -37.5°C in the winter when fully dormant and -4 to -8°C in late spring, while fruits will be damaged by -2 to -4°C. GROWING PERIOD  Perennial. Begins to fruit in the 3rd year and come into full production from the 11th to 20th year. It may continue to fruit for about 100 years although the fruits may become commercially unprofitable. Growing 180-320 days per year. COMMON NAMES  Apple, Pommier, Apel, Mansanas, Appoen, Pom. FURTHER INF  Scientific synonym, M. pumila, M. domestica. In the tropics apple does not do well below 1200 m in elevation and should preferably be grown above 1400 m, depending on variety. It requires a period of winter dormancy, in general 900-1000 hours or more at less than 7°C, but low chilling varieties only needs 200-300 hours below 7.5°C. It perform best in areas with medium to low humidity, with long daylight hours, high light intensity and relatively warm days and cool nights. Apples are susceptible to root lesion nematodes."
1407,Malus domestica,"BRIEF DESCRIPTION A small deciduous tree often trained to a central lead or a delayed open center form reaching a height of 5-10 m. Fruit a pome, globose, ellipsoid to obovoid, usually more than 5 cm in diameter."
1406,Malpighia glabra,"BRIEF DESCRIPTION  A large shrub or small evergreen tree 2-6 m tall, with a short trunk and spreading and densely branched crown. The fruits are light to deep crimson when ripe, 1-3 cm in diameter, with soft, juicy, yellow-orange flesh. USES  The fruit has a high vitamin C content, it can be eaten fresh, but is more often made into jelly, jam, preserves, puree, pie, sherbert, wine, or ice cream. It also has medicinal properties. The bark has been used for tanning. The wood, which is hard and heavy can be used for small utensils. The plant is also used as an ornamental and hedge plant. Mentioned as a possible agroforestry species. KILLING T  Mature trees may tolerate -2 to -3°C for short periods while young trees only may withstand 0 to -1°C. GROWING PERIOD  Perennial evergreen shrub, that will bear in the 2nd year after planting. Seedlings commence flowering when only about 180 days old. (GMIN estimated by the compiler). COMMON NAMES  West Indian cherry, Barbados cherry, Chereese, Jamaica cherry, Puerto Rican cherry, Cerise ronde de Cayenne, Cerise, Surinam cherry, Uste, Nance, Nanche, Ceereja, Cereza, Semeruco, Acerola, Cerise des Antilles, Cerise-antillaise, Cerola, Garden cherry, Acerola, Cheresses, Cereza colorada, Choeri, So'ri. FURTHER INF  Scientific synonyms: M. punicifolia, M. mexicana, M. edulis. West indian cherry is a native of the Caribbean, southern North America, Central America and northern South America. It thrives at elevations between sea level and 800 m, but it can be found at altitudes up to 1700 m. Sandy soils carry an increasing risk of nematode infection and soils should not be infested with nematodes. Good fruit yields range from 14-30 kg of fruit per tree per year, and recorded yields range from 6.7-105 t/ha per year."
7548,Mallotus philippensis,"BRIEF DESCRIPTION  A small to medium-sized evergreen tree reaching up to 25 m in height. It has a short and often fluted bole and thin dark grey bark. USES  A red pigment obtained from the fruits are used to dye silk and wood. he dye also has medicinal properties. The seeds are a source of a drying oil used in cosmetics and to treat parasite infections on the skin. The wood can be used as fuel and the leaves as animal fodder. GROWING PERIOD  Perennial. The tree grows slowly and often does not attain a trunk diameter of 15 cm after 15 years in India. COMMON NAMES  Kamala, Monkey face tree, Kapasan, Banato, Hpawng-awn, Kaai kat hin, Rum noa. FURTHER INF  Scientific synonym: Croton philippense, Rottlara tinctoria. Kamala has a distribution ranging fron western Himalaya, India, South East Asia, Southern China, through to Australia. It can be found at elevations up to nearly 1700 m. It is drought resistant. In the wild state, it is commonly found in evergreen forests but occurs also in shrub and on open rocky land. It is frequently the pioneer tree in secondary forests in India where eventually sal becomes dominant."
